{
  "$schema": "../../packages/codegen/config.schema.json",
  "events": {
    "file": "src/realtime/Events.ts",
    "type": "Events"
  },
  "dispatcher": {
    "file": "src/realtime/useChannelEvent.ts",
    "export": "useChannelEvent"
  },
  "output": "src/hooks/generated",
  "runtime": "simulcast-react",
  "imports": {
    "extension": "none"
  }
}
